============================= test session starts ==============================
platform darwin -- Python 3.9.6, pytest-8.4.2, pluggy-1.6.0
rootdir: /Users/somya/Desktop/Exercise1/exercise2
configfile: pytest.ini
plugins: cov-7.0.0
collected 56 items / 22 deselected / 34 selected

exercise2/part2/tests_added/test_p05_llm_iter1.py .F..                   [ 11%]
exercise2/part2/tests_added/test_p05_llm_iter2.py ..FF.                  [ 26%]
exercise2/part2/tests_added/test_p09_llm_iter1.py .........FFFFFF        [ 70%]
exercise2/part2/tests_added/test_p09_llm_iter2.py FFF.F.                 [ 88%]
exercise2/tests/test_p05.py FFF                                          [ 97%]
exercise2/tests/test_p09.py F                                            [100%]

=================================== FAILURES ===================================
_______________ test_pair_found_with_duplicates_earliest_indices _______________

    def test_pair_found_with_duplicates_earliest_indices():
        nums = [3, 3, 2]
>       assert two_sum(nums, target=6) == (0, 1)
E       assert (1, 0) == (0, 1)
E         
E         At index 0 diff: 1 != 0
E         Use -v to get more diff

exercise2/part2/tests_added/test_p05_llm_iter1.py:10: AssertionError
_______________ test_multiple_pairs_returns_first_by_index_order _______________

    def test_multiple_pairs_returns_first_by_index_order():
        nums = [1, 2, 4, 5]
        i, j = two_sum(nums, target=6)
>       assert (i, j) == (1, 2)
E       assert (2, 1) == (1, 2)
E         
E         At index 0 diff: 2 != 1
E         Use -v to get more diff

exercise2/part2/tests_added/test_p05_llm_iter2.py:13: AssertionError
_______________ test_repeated_numbers_with_self_complement_zero ________________

    def test_repeated_numbers_with_self_complement_zero():
        nums = [0, 0, 1]
>       assert two_sum(nums, target=0) == (0, 1)
E       assert (1, 0) == (0, 1)
E         
E         At index 0 diff: 1 != 0
E         Use -v to get more diff

exercise2/part2/tests_added/test_p05_llm_iter2.py:17: AssertionError
_________________________ test_subtractive_pairs[IV-4] _________________________

s = 'IV', expected = 4

    @pytest.mark.parametrize(
        "s, expected",
        [
            ("IV", 4),
            ("IX", 9),
            ("XL", 40),
            ("XC", 90),
            ("CD", 400),
            ("CM", 900),
        ],
    )
    def test_subtractive_pairs(s, expected):
>       assert roman_to_int(s) == expected
E       AssertionError: assert 6 == 4
E        +  where 6 = roman_to_int('IV')

exercise2/part2/tests_added/test_p09_llm_iter1.py:33: AssertionError
_________________________ test_subtractive_pairs[IX-9] _________________________

s = 'IX', expected = 9

    @pytest.mark.parametrize(
        "s, expected",
        [
            ("IV", 4),
            ("IX", 9),
            ("XL", 40),
            ("XC", 90),
            ("CD", 400),
            ("CM", 900),
        ],
    )
    def test_subtractive_pairs(s, expected):
>       assert roman_to_int(s) == expected
E       AssertionError: assert 11 == 9
E        +  where 11 = roman_to_int('IX')

exercise2/part2/tests_added/test_p09_llm_iter1.py:33: AssertionError
________________________ test_subtractive_pairs[XL-40] _________________________

s = 'XL', expected = 40

    @pytest.mark.parametrize(
        "s, expected",
        [
            ("IV", 4),
            ("IX", 9),
            ("XL", 40),
            ("XC", 90),
            ("CD", 400),
            ("CM", 900),
        ],
    )
    def test_subtractive_pairs(s, expected):
>       assert roman_to_int(s) == expected
E       AssertionError: assert 60 == 40
E        +  where 60 = roman_to_int('XL')

exercise2/part2/tests_added/test_p09_llm_iter1.py:33: AssertionError
________________________ test_subtractive_pairs[XC-90] _________________________

s = 'XC', expected = 90

    @pytest.mark.parametrize(
        "s, expected",
        [
            ("IV", 4),
            ("IX", 9),
            ("XL", 40),
            ("XC", 90),
            ("CD", 400),
            ("CM", 900),
        ],
    )
    def test_subtractive_pairs(s, expected):
>       assert roman_to_int(s) == expected
E       AssertionError: assert 110 == 90
E        +  where 110 = roman_to_int('XC')

exercise2/part2/tests_added/test_p09_llm_iter1.py:33: AssertionError
________________________ test_subtractive_pairs[CD-400] ________________________

s = 'CD', expected = 400

    @pytest.mark.parametrize(
        "s, expected",
        [
            ("IV", 4),
            ("IX", 9),
            ("XL", 40),
            ("XC", 90),
            ("CD", 400),
            ("CM", 900),
        ],
    )
    def test_subtractive_pairs(s, expected):
>       assert roman_to_int(s) == expected
E       AssertionError: assert 600 == 400
E        +  where 600 = roman_to_int('CD')

exercise2/part2/tests_added/test_p09_llm_iter1.py:33: AssertionError
________________________ test_subtractive_pairs[CM-900] ________________________

s = 'CM', expected = 900

    @pytest.mark.parametrize(
        "s, expected",
        [
            ("IV", 4),
            ("IX", 9),
            ("XL", 40),
            ("XC", 90),
            ("CD", 400),
            ("CM", 900),
        ],
    )
    def test_subtractive_pairs(s, expected):
>       assert roman_to_int(s) == expected
E       AssertionError: assert 1100 == 900
E        +  where 1100 = roman_to_int('CM')

exercise2/part2/tests_added/test_p09_llm_iter1.py:33: AssertionError
_____________ test_composite_subtractive_and_mixed_cases[XLII-42] ______________

s = 'XLII', expected = 42

    @pytest.mark.parametrize(
        "s, expected",
        [
            ("XLII", 42),     # 40 + 2
            ("XCIX", 99),     # 90 + 9
            ("CDXLIV", 444),  # 400 + 40 + 4
            ("LVIII", 58),    # 50 + 5 + 3
            ("MCMXCIV", 1994) # 1000 + 900 + 90 + 4
        ],
    )
    def test_composite_subtractive_and_mixed_cases(s, expected):
>       assert roman_to_int(s) == expected
E       AssertionError: assert 62 == 42
E        +  where 62 = roman_to_int('XLII')

exercise2/part2/tests_added/test_p09_llm_iter2.py:15: AssertionError
_____________ test_composite_subtractive_and_mixed_cases[XCIX-99] ______________

s = 'XCIX', expected = 99

    @pytest.mark.parametrize(
        "s, expected",
        [
            ("XLII", 42),     # 40 + 2
            ("XCIX", 99),     # 90 + 9
            ("CDXLIV", 444),  # 400 + 40 + 4
            ("LVIII", 58),    # 50 + 5 + 3
            ("MCMXCIV", 1994) # 1000 + 900 + 90 + 4
        ],
    )
    def test_composite_subtractive_and_mixed_cases(s, expected):
>       assert roman_to_int(s) == expected
E       AssertionError: assert 121 == 99
E        +  where 121 = roman_to_int('XCIX')

exercise2/part2/tests_added/test_p09_llm_iter2.py:15: AssertionError
____________ test_composite_subtractive_and_mixed_cases[CDXLIV-444] ____________

s = 'CDXLIV', expected = 444

    @pytest.mark.parametrize(
        "s, expected",
        [
            ("XLII", 42),     # 40 + 2
            ("XCIX", 99),     # 90 + 9
            ("CDXLIV", 444),  # 400 + 40 + 4
            ("LVIII", 58),    # 50 + 5 + 3
            ("MCMXCIV", 1994) # 1000 + 900 + 90 + 4
        ],
    )
    def test_composite_subtractive_and_mixed_cases(s, expected):
>       assert roman_to_int(s) == expected
E       AssertionError: assert 666 == 444
E        +  where 666 = roman_to_int('CDXLIV')

exercise2/part2/tests_added/test_p09_llm_iter2.py:15: AssertionError
___________ test_composite_subtractive_and_mixed_cases[MCMXCIV-1994] ___________

s = 'MCMXCIV', expected = 1994

    @pytest.mark.parametrize(
        "s, expected",
        [
            ("XLII", 42),     # 40 + 2
            ("XCIX", 99),     # 90 + 9
            ("CDXLIV", 444),  # 400 + 40 + 4
            ("LVIII", 58),    # 50 + 5 + 3
            ("MCMXCIV", 1994) # 1000 + 900 + 90 + 4
        ],
    )
    def test_composite_subtractive_and_mixed_cases(s, expected):
>       assert roman_to_int(s) == expected
E       AssertionError: assert 2216 == 1994
E        +  where 2216 = roman_to_int('MCMXCIV')

exercise2/part2/tests_added/test_p09_llm_iter2.py:15: AssertionError
__________________________________ test_basic __________________________________

    def test_basic():
        nums = [2,7,11,15]
        target = 9
>       _check(nums, target, two_sum(nums, target))

tests/test_p05.py:13: 
_ _ _ _ _ _ _ _ _ _ _ _ _ _ _ _ _ _ _ _ _ _ _ _ _ _ _ _ _ _ _ _ _ _ _ _ _ _ _ _ 

nums = [2, 7, 11, 15], target = 9, pair = (1, 0)

    def _check(nums, target, pair):
        i, j = pair
>       assert 0 <= i < j < len(nums)
E       assert 1 < 0

tests/test_p05.py:7: AssertionError
_____________________________ test_with_duplicates _____________________________

    def test_with_duplicates():
        nums = [3,2,4]
        target = 6
>       _check(nums, target, two_sum(nums, target))

tests/test_p05.py:18: 
_ _ _ _ _ _ _ _ _ _ _ _ _ _ _ _ _ _ _ _ _ _ _ _ _ _ _ _ _ _ _ _ _ _ _ _ _ _ _ _ 

nums = [3, 2, 4], target = 6, pair = (2, 1)

    def _check(nums, target, pair):
        i, j = pair
>       assert 0 <= i < j < len(nums)
E       assert 2 < 1

tests/test_p05.py:7: AssertionError
________________________________ test_any_valid ________________________________

    def test_any_valid():
        nums = [1,3,3,4]
        target = 6
>       _check(nums, target, two_sum(nums, target))

tests/test_p05.py:23: 
_ _ _ _ _ _ _ _ _ _ _ _ _ _ _ _ _ _ _ _ _ _ _ _ _ _ _ _ _ _ _ _ _ _ _ _ _ _ _ _ 

nums = [1, 3, 3, 4], target = 6, pair = (2, 1)

    def _check(nums, target, pair):
        i, j = pair
>       assert 0 <= i < j < len(nums)
E       assert 2 < 1

tests/test_p05.py:7: AssertionError
________________________________ test_examples _________________________________

    def test_examples():
        assert roman_to_int("III") == 3
>       assert roman_to_int("IV") == 4
E       AssertionError: assert 6 == 4
E        +  where 6 = roman_to_int('IV')

tests/test_p09.py:7: AssertionError
================================ tests coverage ================================
_______________ coverage: platform darwin, python 3.9.6-final-0 ________________

Coverage HTML written to dir exercise2/part3/bug1/htmlcov
Coverage XML written to file exercise2/part3/bug1/coverage.xml
=========================== short test summary info ============================
FAILED exercise2/part2/tests_added/test_p05_llm_iter1.py::test_pair_found_with_duplicates_earliest_indices
FAILED exercise2/part2/tests_added/test_p05_llm_iter2.py::test_multiple_pairs_returns_first_by_index_order
FAILED exercise2/part2/tests_added/test_p05_llm_iter2.py::test_repeated_numbers_with_self_complement_zero
FAILED exercise2/part2/tests_added/test_p09_llm_iter1.py::test_subtractive_pairs[IV-4]
FAILED exercise2/part2/tests_added/test_p09_llm_iter1.py::test_subtractive_pairs[IX-9]
FAILED exercise2/part2/tests_added/test_p09_llm_iter1.py::test_subtractive_pairs[XL-40]
FAILED exercise2/part2/tests_added/test_p09_llm_iter1.py::test_subtractive_pairs[XC-90]
FAILED exercise2/part2/tests_added/test_p09_llm_iter1.py::test_subtractive_pairs[CD-400]
FAILED exercise2/part2/tests_added/test_p09_llm_iter1.py::test_subtractive_pairs[CM-900]
FAILED exercise2/part2/tests_added/test_p09_llm_iter2.py::test_composite_subtractive_and_mixed_cases[XLII-42]
FAILED exercise2/part2/tests_added/test_p09_llm_iter2.py::test_composite_subtractive_and_mixed_cases[XCIX-99]
FAILED exercise2/part2/tests_added/test_p09_llm_iter2.py::test_composite_subtractive_and_mixed_cases[CDXLIV-444]
FAILED exercise2/part2/tests_added/test_p09_llm_iter2.py::test_composite_subtractive_and_mixed_cases[MCMXCIV-1994]
FAILED exercise2/tests/test_p05.py::test_basic - assert 1 < 0
FAILED exercise2/tests/test_p05.py::test_with_duplicates - assert 2 < 1
FAILED exercise2/tests/test_p05.py::test_any_valid - assert 2 < 1
FAILED exercise2/tests/test_p09.py::test_examples - AssertionError: assert 6 ...
================= 17 failed, 17 passed, 22 deselected in 0.23s =================
